full_text,username,created_at,klasifikasi
nomor penting jalan mudik,pengabdiaglioo,Wed Mar 27 12:39:50 +0000 2024,Netral
ayo manfaat sempat mudik gratis,topas_s,Wed Mar 27 12:00:09 +0000 2024,Netral
ini himbauan polri saat mudik,senopa60331,Wed Mar 27 12:59:24 +0000 2024,Netral
mudik polri pasti aman lancar,senopa60331,Wed Mar 27 12:55:55 +0000 2024,Netral
mudik gratis polri presisi kurang beban jalan tol arteri dari tahun tahun polri terus sedia layan mudik gratis masyarakat akan raya momen lebaran berangkat mudik gratis lapang monas jakarta pusat mantapsiapkanmudik,PolsekKertasari,Wed Mar 27 06:27:53 +0000 2024,Netral
plat aa kapan mudik yujiem,UGM_FESS,Wed Mar 27 08:27:29 +0000 2024,Netral
rabu 27032024 17 romadhon 1445 h jangan cari yang baik cari yang bisa terima dengan baik puasa romadhon mudik lebaran,GloballandSby,Wed Mar 27 09:57:58 +0000 2024,Netral
info mudik polresta cilacap polrestacilacap,HERIHER26911725,Wed Mar 27 21:15:40 +0000 2024,Netral
mau ngumpulin orangorang gapunya kampung ato kaga mudik terus bikin acara sendiri maap2an sendiri bikin keluarga sendiri asik sendiri,skipberat,Thu Mar 28 08:41:23 +0000 2024,Netral
ubah sarana ka argo bromo anggrek ka sembrani jelang angkut lebaran 2024 kaka ganti rangkai nih guys pasti bikin mudik kalian makin nyaman bestie kaka sebut ka argo bromo anggrek mulai guna rangkai kereta,KAI121,Thu Mar 28 06:13:46 +0000 2024,Netral
few tweets au abiapihjuna mudik abi hari kerjaanya banyak banget capek ken pulang buka puasa bareng trus kelon mumpung besok libur tapi abi besok juna rumah embah umi loh iya besok juna ketemu ombu iya abi mudik tgl 5,missaccio,Thu Mar 28 12:04:24 +0000 2024,Negatif
mudik dluan yaaaaaaa,adhc29,Thu Mar 28 05:37:38 +0000 2024,Netral
pasuk waktu mudik naik kendara apa rame banyak orang biar nyaman jalan panjang bawa lengkap mudah mudik lebaran mudik 2024 toiletries travel kit,gyanetta_,Thu Mar 28 04:31:08 +0000 2024,Netral
mudik gratis murah aja nih,beruqkuvuki,Thu Mar 28 08:34:23 +0000 2024,Netral
kamu mudik,radenrauf,Thu Mar 28 15:26:06 +0000 2024,Netral
siapa udah siap mudik nih evosquad nah jangan lupa stock bio creamy snack andal anabul indonesia bawa manamana yaaa,evopetid,Thu Mar 28 03:00:01 +0000 2024,Netral
tips mudik,Jeansbirutua,Thu Mar 28 21:28:38 +0000 2024,Netral
tips mudik sehat saat puasa,EnrekangPolres,Thu Mar 28 08:54:38 +0000 2024,Netral
dapet bahan baca baru anakanak dapet tas sekolah baru yang mau pake mudik lebaran,adionooo,Thu Mar 28 04:55:48 +0000 2024,Netral
satu keluarga asal pagar alam sumatera selatan sumsel alami racun ada dalam mobil xenia bg 1643 mj hendak mudik bandung jawa barat jabar focus acmobil news videonews,kumparan,Thu Mar 28 05:13:42 +0000 2024,Netral
kurang lebih begini kali umbi all in thrnya tiket mudik,pejabrut,Thu Mar 28 01:17:45 +0000 2024,Netral
jinuk mw mudik,goldentimeteam,Thu Mar 28 11:56:26 +0000 2024,Netral
lebih pilih naik kereta bus kalau mudik,2KangKomen,Thu Mar 28 21:22:13 +0000 2024,Netral
sobat polri jangan lupa periksa rumah kamu mudik yaa selalu pasti rumah kamu bisa tinggal aman selamat mudik hatihati jalan yaa moga selamat tuju,DivHumas_Polri,Thu Mar 28 10:43:55 +0000 2024,Netral
siap mudik versi beli kabel charger iphone panjaaang soal rumah stop kontak jauh kasur jadi butuh kabel 2 meter beli merek belkin lagi diskon fyi gaes belkin merek aksesoris selalu di apple store negara mana jadi,bhaguz_403,Thu Mar 28 11:58:43 +0000 2024,Netral
anti cemas ninggal rumah mudik,briancctv01,Thu Mar 28 11:48:00 +0000 2024,Netral
anti cemas ninggalin rumah mudik,KenArok4444,Thu Mar 28 11:42:59 +0000 2024,Netral
siap mudik,Txtdarigarut_,Thu Mar 28 04:29:48 +0000 2024,Netral
wota mudik,SatmikoAdiyatmo,Thu Mar 28 21:01:56 +0000 2024,Netral
mudik gratis,BalmondSakti,Thu Mar 28 00:37:11 +0000 2024,Netral
langkah jitu polisi aman mudik 2024,briancctv01,Thu Mar 28 11:47:21 +0000 2024,Netral
mudik gaes start jam 4 td,danseee_,Thu Mar 28 23:39:40 +0000 2024,Netral
tips mudik sehat puasa,SatlantasParimo,Thu Mar 28 00:26:56 +0000 2024,Netral
mudik 2024,KenArok4444,Thu Mar 28 11:46:34 +0000 2024,Netral
kulkas portable mini mobil multifungsi cocok banget mudik cek harga,joncwn,Thu Mar 28 05:14:33 +0000 2024,Netral
mudik bekal iman takwa sertaaaa tugas gepok,wantstoberich_,Thu Mar 28 18:44:40 +0000 2024,Netral
innalillahi satu mobil racun pas mau mudik sumsel jabar polisi duga ac peristiwa jadi mobil risi 8 orang laju tol indralayaprabumulih,C4k_D3pp,Thu Mar 28 00:25:44 +0000 2024,Netral
kaveh mudik,svanchan24,Thu Mar 28 08:40:24 +0000 2024,Netral
starter pack mudik lebaran a thread t travel pack pulang kampung ramadan ramadanekstraseru,kayyscollect,Thu Mar 28 04:16:00 +0000 2024,Netral
mudik 2024,CoffenBee,Thu Mar 28 08:52:16 +0000 2024,Netral
rame udah mudik,yudodwii,Thu Mar 28 17:20:29 +0000 2024,Netral
gagal mudik tipu tiket pesawat wkwkwk,akangdenn,Thu Mar 28 07:59:23 +0000 2024,Netral
anti cemas ninggalin rumas mudik,nobitaaa27,Thu Mar 28 08:04:01 +0000 2024,Netral
kalian kalo lebaran tim mudik apa etidak gesss,jjhpeachybluu,Thu Mar 28 03:38:00 +0000 2024,Netral
tips mudik manti,Titiksu2023,Thu Mar 28 08:39:45 +0000 2024,Netral
tips anti cemas ninggalin rumah mudik nih guys,pengabdiaglioo,Thu Mar 28 09:00:20 +0000 2024,Netral
mudik aman rumah aman,Marsel11loser,Thu Mar 28 09:34:52 +0000 2024,Netral
mauu otw mudik iksan dulu,itssmentnn,Thu Mar 28 14:56:37 +0000 2024,Netral
tips selamat mudik,pengabdiaglioo,Thu Mar 28 09:00:30 +0000 2024,Netral
tips mudik sehat saat puasa mantapsiapkanmudik,Humas_marang20,Thu Mar 28 08:49:18 +0000 2024,Netral
info mudik,BalmondSakti,Thu Mar 28 00:37:55 +0000 2024,Netral
tahap 2 rekayasa lalu lintas jelang mudik lebaran 2024,PolsekTambkromo,Thu Mar 28 02:32:56 +0000 2024,Netral
halo emang ya tiket mudik gratis bis jual sama ketua daop 1,seringkluyuran,Thu Mar 28 12:37:56 +0000 2024,Netral
mudik aman,Noorhafiza84070,Thu Mar 28 11:34:37 +0000 2024,Netral
supaya enak mudik na,rzlhkmmm,Thu Mar 28 01:33:09 +0000 2024,Netral
tentu jalan mudik,nobitaaa27,Thu Mar 28 08:04:20 +0000 2024,Netral
info mudik woiii,Pujanggalapuk1,Thu Mar 28 10:04:50 +0000 2024,Netral
akhir udah mudik gaes letsgoo pulang kampung naik shinkansen stream starts at 1900 wib waiting room,AvenVILITERA,Thu Mar 28 10:31:18 +0000 2024,Netral
perhati belum mudik,Titiksu2023,Thu Mar 28 08:40:01 +0000 2024,Netral
ayo mudik aman san lancar,Marsel11loser,Thu Mar 28 09:34:32 +0000 2024,Netral
anti cemas ninggaling rumah mudik,senopa60331,Thu Mar 28 09:56:42 +0000 2024,Netral
tips tinggal rumah mudik mudik2024 mudikaman mudiknyaman,any_cinta88,Thu Mar 28 09:27:56 +0000 2024,Netral
anti cemas ninggalin rumah mudik,Ferri254,Thu Mar 28 09:03:22 +0000 2024,Netral
mudik sekarang makin nyaman moga,Pujanggalapuk1,Thu Mar 28 09:58:07 +0000 2024,Netral
mudik aman selamat,Marsel11loser,Thu Mar 28 09:35:20 +0000 2024,Netral
tips mudik lebaran idul fitri 2024 agar aman nyaman sehat,Azizahhuma,Thu Mar 28 08:44:23 +0000 2024,Netral
tamat mudik,gemaalfabeta,Thu Mar 28 12:01:43 +0000 2024,Netral
moga mudik bisa lancar,Titiksu2023,Thu Mar 28 08:40:49 +0000 2024,Netral
tentu jalan mudik,BalmondSakti,Thu Mar 28 14:03:07 +0000 2024,Netral
semangat pak polisi aman mudik tahun,Kus876605864670,Thu Mar 28 08:31:09 +0000 2024,Netral
ayok mudik tetap pedoman hal ikut,peloporID4NER,Thu Mar 28 12:05:51 +0000 2024,Netral
jadwal mudik gratis presisi 2024,BalmondSakti,Thu Mar 28 00:37:36 +0000 2024,Netral
ini kesiap polri instansi kait hadap mudik 2024,senopa60331,Thu Mar 28 09:24:58 +0000 2024,Netral
info tentu jalan mudik,senopa60331,Thu Mar 28 09:38:00 +0000 2024,Netral
tahap 2 rekayasa lalu lintas jelang mudik lebaran 2024,PolsekTambkromo,Thu Mar 28 02:31:01 +0000 2024,Netral
yuk mudik aman nyaman sehat,peloporID4NER,Thu Mar 28 12:05:26 +0000 2024,Netral
info tentu jalan mudik,GunDalf888,Thu Mar 28 09:30:23 +0000 2024,Netral
ken ngerasain mudik rumah kamu,dendam___,Thu Mar 28 16:53:05 +0000 2024,Netral
seperti biasa tahun gak mudik jagain pos ronda,BanditReadyDepp,Thu Mar 28 14:11:21 +0000 2024,Netral
mudik bus balik kereta sigh thats a lot of money,he_iia,Thu Mar 28 13:26:43 +0000 2024,Netral
mudik polri pasti aman pasti lancar,BalmondSakti,Thu Mar 28 00:38:57 +0000 2024,Netral
suv compact nyaman dipake mudik nih wuing alvez fiturnya udah lengkap bgt kalian gimana,HenryManullang4,Thu Mar 28 08:19:26 +0000 2024,Netral
alahh hayang geura mudik duhh,arifacil33,Thu Mar 28 09:28:37 +0000 2024,Netral
idam gw bgt wuling alvez harga murah kelas mobil ganteng fitur radar aman klo bawa jauh apalagi mudik udh aman nyaman,danielastime,Thu Mar 28 05:21:07 +0000 2024,Netral
ganti oli mesin mobil anda spesifikasi tepat jalan mudik,kompascom,Thu Mar 28 21:16:35 +0000 2024,Netral
adegan dewasa beli koper bagus mudik worth it mana dua brand beda,panggilnayyyy,Fri Mar 29 12:20:03 +0000 2024,Positif
area rumah gua keren 2 tol tol baru joglosemar sama tol boyolali kalo musim mudik begini siap siap susah tidur suara kendara,Catatan_ali7,Fri Mar 29 10:21:05 +0000 2024,Netral
wajar tahun sekali ambil untung cuk mudik banyak yang cuma taun sekali bener2 gak lindung sama rakyat tuh,kozirama,Fri Mar 29 21:16:58 +0000 2024,Netral
few tweets au abiapihjuna apih amp juna mudik siang abi nganterin juna amp apih stasiun mudik semarang yang liat happy 100 cuma si juna abi sama apih kaya tidak rela,missaccio,Fri Mar 29 06:15:04 +0000 2024,Positif
tips mudik ceria tahun 2024,samuelernando22,Fri Mar 29 08:47:17 +0000 2024,Netral
cerita horor paling seram wanita mudik dari lampung ke bekas saya lihat bis ramai ramai sekali orang koper hitam akhir pacar telpon kalau nyata bis tidak siapasiapa a thread ceritaserem,RJL5_official,Fri Mar 29 13:47:15 +0000 2024,Netral
mudik tol gratis tentu lebih puntuk rakyat nyaman itu malaysia di indonesia tenangtenangbeberapa ruas tol bakal naik,LArismi11,Fri Mar 29 18:45:06 +0000 2024,Netral
ftd anak perthchimon kaya mau mudik badan cuma 3cm bawa gunung,fessthai,Fri Mar 29 12:37:45 +0000 2024,Netral
tips mudik aman ceria,gumilar_1983,Fri Mar 29 09:11:57 +0000 2024,Netral
di catat yang mau mudik arah jakarta karena ramadhan tiba mudik tiba sini cek jadwal contra flow one way ganjil genap arus mudik lebaran 2024,Jateng_Twit,Fri Mar 29 16:34:32 +0000 2024,Netral
sapa besok mudik lebaran kaya gin cunggg,kochengfs,Fri Mar 29 07:41:14 +0000 2024,Netral
jangan nekat bandel mudik naik motor bahaya ya gaisss,Pujanggalapuk1,Fri Mar 29 08:50:08 +0000 2024,Netral
seventeen d1 concert feels like the day before mudik lebaran,xmnghoes,Fri Mar 29 08:27:19 +0000 2024,Netral
selamat mudik temanteman,dnquixotedev,Fri Mar 29 04:17:25 +0000 2024,Netral
tida sabar mudik lewat tol trans jawa pandang suv amp mpv ladder frame bbm 6800nya yang saling kebut2an padahal rem standar,navareaval,Fri Mar 29 10:29:40 +0000 2024,Netral
lu mudik kaga,nzights,Fri Mar 29 12:22:44 +0000 2024,Netral
mudik moments with indonesian railways,mezaidanfaadhil,Fri Mar 29 17:00:23 +0000 2024,Netral
kakorlantas polri irjen pol dr drs aan suhanan m si jelas langkahlangkah antisipasi polri hadap potensi bencana jalur mudik lebaran 2024 dengan meta 155 titik rawan bencana telah siap jalur alternatif utama jalur pantura,DivHumas_Polri,Fri Mar 29 16:19:08 +0000 2024,Netral
mudik aman selamat bawa barang bawa cukup,any_cinta88,Fri Mar 29 11:26:37 +0000 2024,Netral
bismillah kita mudik dulu naik tayo gaes,babyto332,Sat Mar 30 23:48:35 +0000 2024,Netral
hati hati yang mau mudik,sosmedkeras,Sat Mar 30 16:39:05 +0000 2024,Netral
rute mudik tahun yang bekas yuk jalan bareng,KangManto123,Sat Mar 30 10:46:02 +0000 2024,Netral
rekayasa lalin mudik 2024 rekan sahabat arah sumatra guna seberang,irfidipaido,Sat Mar 30 02:42:56 +0000 2024,Netral
aku benar benar happy akhir pulang jd aku bawa mudikgtlt,fwairyyuta,Sat Mar 30 07:39:48 +0000 2024,Positif
pov jam 3 pagi kereta ekonomi pas mudik dapet duduk pojok deket jendela,bogorshorthair,Sat Mar 30 07:09:13 +0000 2024,Netral
begini kondisi jumlah terminal ibu kota jelang mudik lebaran 2024 lihat ada padat tumpang secretnumber jinny soodam la dita,babydami09,Sat Mar 30 05:10:48 +0000 2024,Netral
mudik gratis projo projo jokowi prabowogibran indonesiaemas,Projo_Pusat,Sat Mar 30 01:14:50 +0000 2024,Netral
asiiiik kali alam perdana pulang mudik naik kapal pelni senang bismillah,ethadisaputra,Sat Mar 30 06:58:36 +0000 2024,Netral
kamu tipe mudik mana guys sebenernya apa tipe mudik asal gak lupa beli proteksi asuransi jaga mudik by jaga libur tuh sahsah aja kok soal siap jagain kamu jalan pergi sampe pulang ke rumah premi mulai rp15 ribu aja,JAGADIRI_ID,Sat Mar 30 08:29:47 +0000 2024,Netral
perintah komitmen hadir mudik lebaran 2024 lancar aman amp nyaman untuk wujud ini terbit buku elektronik mudikpedia mudikpedia saji ragam informasi masyarakat mudik lama periode lebaran 2024 budiariesetiadi,Projo_Pusat,Sat Mar 30 15:06:31 +0000 2024,Netral
ya allah mudik gue yang merinding moga selamat sampe tuju bapaaak,tanyakanrl,Sat Mar 30 11:31:23 +0000 2024,Netral
tari tolak bala bencana jalan darat mudik,teenfreish,Sat Mar 30 05:37:26 +0000 2024,Netral
mudik gratis projo projo jokowi prabowogibran indonesiaemas,RcyberProj0,Sat Mar 30 05:04:09 +0000 2024,Netral
kalian udah siap mudik aku mau kasih inspirasi barang mungkin kalian butuhin mudik cek sini,cuteeeeee__,Sat Mar 30 01:32:18 +0000 2024,Netral
tahun mudik mana,dsuperboy,Sat Mar 30 10:50:13 +0000 2024,Netral
mudik lebih awal,ARSIPAJA,Sat Mar 30 10:00:07 +0000 2024,Netral
cousin said he had just purchased a new motorbike and wanted me to ride along but it seems entire fam here also wanted to go there early mudik they said the driver the youngsters ofc me included,StrandedPietist,Sat Mar 30 13:56:21 +0000 2024,Positif
klo gitu minnov mau bahas mobil pertama cocok mudik harga bawah 50jt favorite minnov a threads link affiliate akhir,innovacommunity,Sat Mar 30 21:30:27 +0000 2024,Positif
jadi bener mana pulang kampung mudik,justikanew,Sat Mar 30 05:47:29 +0000 2024,Netral
semangat makin deket berangkat mudik medan nya hehe,ahabibpaat25,Sat Mar 30 00:39:39 +0000 2024,Netral
lebaran taun ga fomo beli baju baru aku ngebet banget beli mukena travel satu ini so aku repurchase mukena alif siap mudik amp lebaran,laelaumikha,Sat Mar 30 10:41:10 +0000 2024,Netral
nih lipen dah tak angkut mudik lebaran racuninmakeup,windanoona_,Sat Mar 30 07:23:17 +0000 2024,Netral
kabar gembira tol gratis lama mudik kabar sedih hanya malaysia,hipohan,Sat Mar 30 02:34:14 +0000 2024,Netral
mudik inspirasi film up alias mudik serumahrumah,eseojoon,Sat Mar 30 11:42:20 +0000 2024,Netral
bayangin mudik kyk org pickme bawa laprak juprak chempro bljr uts kim,syecheeze,Sat Mar 30 05:58:16 +0000 2024,Netral
tinggal mudik,prabanu_,Sat Mar 30 03:17:00 +0000 2024,Netral
jends moga kuliah beri lancar meski moratmarit begini hehe yang mudik hatihati jalan,Unsoedfess1963,Sat Mar 30 15:07:17 +0000 2024,Netral
wts edisi butuh dana mudik v ambil semua harga spesial,Bang_icall14,Sat Mar 30 15:33:38 +0000 2024,Netral
masak udah h6 mudik thr belum cair,MafiaWasit,Sat Mar 30 12:28:51 +0000 2024,Netral
info arus mudik lebaran 2024,samuelernando22,Sat Mar 30 11:50:32 +0000 2024,Netral
himbauan mudik polda banten th 2024,Sek_Mancak,Sat Mar 30 13:53:48 +0000 2024,Netral
posko mudik aman ramadhan satkorcab banser pc gp ansor sidoarjo poskomudikbanser poskomudikansor,amrudinnejad_,Sat Mar 30 09:05:10 +0000 2024,Netral
as we bask in the fasting ambiance approaching the joyous occasion of eid a time traditionally associated with mudik what better time than now to embark on this journey homeward hand in hand with our cherished ones,bluxhon,Sat Mar 30 12:34:41 +0000 2024,Positif
kalian mudik ga gais,convomfs,Sat Mar 30 10:41:37 +0000 2024,Netral
mudik aman nyaman dengan 3 pasti,samuelernando22,Sat Mar 30 11:56:13 +0000 2024,Netral
baca keluh kesah orang candu judi online salah satu forum fesbuk gaji thr amblas dipake deposit zonk gak apaapa trus skrg bingung gak mudik gak belikan baju lebaran anak orangorang tolol kek gin ken kutampol aja,WidasSatyo,Sat Mar 30 15:15:04 +0000 2024,Netral
alhamdulillah tol gratis lama musim mudik selamat pimpin rakyat makmur jamin indon malag baru aja naik rakyat apa gencet aja terus,pakaipeci,Sat Mar 30 02:43:47 +0000 2024,Netral
hindar tumpu batas guna rest area 30 menit polri prediksi titiktitik krusial fokus aman arus mudikbalik lebaran 2024 antara jalur tol labuh tempat wisata selain polri lalu korlantas polri koordinasi,DivHumas_Polri,Sat Mar 30 09:52:55 +0000 2024,Netral
tips aman mudik lebaran tahun 2024 guna motor,samuelernando22,Sat Mar 30 11:59:30 +0000 2024,Netral
kalo kerabat plg mudik jgn suka minta ya minta traktir makan minta thr krn tdk semua rantau mudik bawa uang byk dgn uang pas upaya plg krn rindu org tua sodara,Safa_Andriana,Sat Mar 30 03:33:41 +0000 2024,Netral
mudik aman nyaman dengan 3 pasti,KenArok4444,Sat Mar 30 12:03:45 +0000 2024,Netral
tips mudik aman guna transporasti umum,samuelernando22,Sat Mar 30 11:44:13 +0000 2024,Netral
tim mudik tim rumah aja kalau minlab mudik nih,whitelab_id,Sat Mar 30 05:06:59 +0000 2024,Netral
ken mudik nyaman,KenArok4444,Sat Mar 30 11:46:35 +0000 2024,Netral
mudik nyaman hindar puncak arus mudik lebaran 2024,samuelernando22,Sat Mar 30 11:47:41 +0000 2024,Netral
first mudik ever,Andrianugrahaa,Sat Mar 30 04:19:23 +0000 2024,Positif
info arus mudik lebaran 2024,samuelernando22,Sat Mar 30 11:52:33 +0000 2024,Netral
the last bukber before mudik,ubetpoter,Sat Mar 30 22:01:21 +0000 2024,Netral
mudik aman mudik ceria mudik tahun 2024,NadiaNarin4,Sat Mar 30 12:51:47 +0000 2024,Netral
mudik sby mo ikut bukber ama tetangga2 rmh ortu s we re going to have breakfasting at diff hotel in sby m what happen with hotel 88 their food looks good s probably some people can t afford m how many of them i dont mind helping them s going to sell your kidney,sariludwig,Sat Mar 30 09:00:01 +0000 2024,Positif
ka argo meru edisi lebaran lintas kretek kewek yogyakarta kereta api rute gambir surabaya gubeng pp tampil decalsticker selamat idul fitri 1445 h tambah kesan mudik kalian asa lebih istimewa hajar prasetyo,merapi_uncover,Sat Mar 30 10:19:06 +0000 2024,Netral
mudik aman nyaman 3,nobitaaa27,Sat Mar 30 10:09:22 +0000 2024,Netral
mudik aman,CoffenBee,Sat Mar 30 12:28:07 +0000 2024,Netral
malaysia umum kembali gratis jalan tol masa mudik lebaran 2024 89 april 2024,kompascom,Sat Mar 30 06:35:10 +0000 2024,Netral
mudik keluarga,bubblesybulbs,Sat Mar 30 04:23:27 +0000 2024,Netral
beneran kaya mudik,manusiagabut_18,Sat Mar 30 07:25:48 +0000 2024,Netral
ini beda banget sistem us lama gue tinggal sana tax refund adalah yang gue tunggutunggu duit dipake macemmacem masuk libur luar negeri beli tiket mudik indonesia bayang betapa syok gue pas balik indonesia,AmirahWahdi,Sat Mar 30 05:04:35 +0000 2024,Netral
kagak thr om kalian ga mudik tahun,jjknoona,Sat Mar 30 13:14:57 +0000 2024,Netral
mudik anan nyaman 3,Pujanggalapuk1,Sat Mar 30 11:35:33 +0000 2024,Netral
h brp mudik wonogiri lur,JonathanIndarto,Sat Mar 30 04:30:16 +0000 2024,Netral
informasi mudik lebaran,CoffenBee,Sat Mar 30 12:24:22 +0000 2024,Netral
vibesnya dah kek orang mudik,mrtbkcoklat_,Sat Mar 30 05:55:00 +0000 2024,Netral
mudik aman 2024,PoponManiac,Sat Mar 30 13:26:51 +0000 2024,Netral
mudik aman 2024,PoponManiac,Sat Mar 30 13:27:07 +0000 2024,Netral
mudik aman,CoffenBee,Sat Mar 30 12:22:26 +0000 2024,Netral
mudik aman 2024,PoponManiac,Sat Mar 30 13:27:19 +0000 2024,Netral
mudik aman 2024,PoponManiac,Sat Mar 30 13:26:58 +0000 2024,Netral
mudik anan nyaman 3,gumilar_1983,Sat Mar 30 10:49:17 +0000 2024,Netral
puluh posko aman ramadhan mudik pc gp ansor sidoarjo resmi buka mulai resmi buka langsung ketua pc gp ansor sidoarjo rizza ali faizin poskomudikbanser poskomudikansor,pwansorjatim,Sat Mar 30 08:55:57 +0000 2024,Netral
mudik aman nyaman,Joe_clash38896,Sat Mar 30 13:56:30 +0000 2024,Netral
tips mudik aman guna trasportasi umum,Pujanggalapuk1,Sat Mar 30 11:30:34 +0000 2024,Netral
tips mudik aman guna trasportasi umum,Ferri254,Sat Mar 30 11:29:31 +0000 2024,Netral
mudik aman nyanan 3,Ferri254,Sat Mar 30 11:29:46 +0000 2024,Netral
bahagia kalian masih punya nenek karna bakal tempat ngumpul bareng mudik lebaran,Nagoya0923,Sat Mar 30 03:19:13 +0000 2024,Netral
tips mudik aman guna transportasi umum,Raramangku,Sat Mar 30 10:48:32 +0000 2024,Netral
tips mudik aman guna transportasi umum,senopa60331,Sat Mar 30 12:00:41 +0000 2024,Netral
mau mudik kapan klean,Onyour_chan6,Sat Mar 30 11:04:40 +0000 2024,Netral
tahun lalu 1 6 juta guna lewat tol cipali lama arus mudik arus balik kalau rata2 mrka spend rp 500 ribu bayar tol total biaya rp 800 milyar jauh bawah anggar bansos rp 500 triliun,Strategi_Bisnis,Sun Mar 31 21:23:44 +0000 2024,Netral
ringroud utara ready hijabnon hijab ready bo amp vcs exinc bojogja availjogja openbojogja expojogja wpjogja jogjaopenbo promo lt yuk mudik nich bentar lebaran,YokahuhEll,Sun Mar 31 13:38:31 +0000 2024,Positif
udah mulai musim mudik nih malah mati lagi fasumnya mana tugas kelean kata siap gendong,PernebangRoket,Sun Mar 31 03:16:16 +0000 2024,Netral
beda indonesia malaysia gratis tol mudik lebaran 2024 gooto,tempodotco,Sun Mar 31 09:06:36 +0000 2024,Netral
informasi sahabat ui sekali gw info mudik gratis henti akhir semarang berangkat tgl 4 april jam 8 kampus ui depok barangsiapa mau barengmembutuhkan info lebih lanjut sila tinggal jejak bawah dm nya buka tengkyuu,uibaseNG,Sun Mar 31 06:26:03 +0000 2024,Netral
belum lampung sahabat pada nyiapin untuk bawa kekaliantan lebaran2024 mudik lampung,Id_Kal2,Sun Mar 31 15:50:01 +0000 2024,Netral
give away info mudik yang mau,2KangKomen,Sun Mar 31 03:23:35 +0000 2024,Netral
polri instansi kait jalan bagai langkah aman hadap arus mudikbalik lebaran 2024 salah satu pasti sedia bbm masyarakat cegah praktik curang spbu mulai manipulasi dispenser hingga oplos bbm,DivHumas_Polri,Sun Mar 31 02:38:47 +0000 2024,Netral
siap mudik,maulyhartomo,Sun Mar 31 11:47:06 +0000 2024,Netral
utama selamat tips mudik 2024,RondaE71,Sun Mar 31 07:56:11 +0000 2024,Netral
ak hri mudik,Saewonwoo,Sun Mar 31 23:25:44 +0000 2024,Netral
pas bgt konsep nya mudik lebaran,kaktaeri,Sun Mar 31 16:54:43 +0000 2024,Netral
si bocil mudik nihh,EningPurwaning6,Sun Mar 31 22:36:00 +0000 2024,Netral
utama selamat tips mudik 2024,melsalsida,Sun Mar 31 07:54:28 +0000 2024,Netral
mudik peps,gabrielerick_1,Sun Mar 31 12:35:56 +0000 2024,Netral
utama selamat tips mudik 2024,melsalsida,Sun Mar 31 07:54:38 +0000 2024,Netral
utama selamat tips mudik 2024,melsalsida,Sun Mar 31 07:54:29 +0000 2024,Netral
utama selamat tips mudik 2024,melsalsida,Sun Mar 31 07:54:16 +0000 2024,Netral
akhir mudik ke pekanbaru,sipaling_N,Sun Mar 31 09:07:13 +0000 2024,Netral
utama selamat tips mudik 2024,greeen_applee,Sun Mar 31 07:55:09 +0000 2024,Netral
utama selamat tips mudik 2024,anericanlirry,Sun Mar 31 07:57:11 +0000 2024,Netral
yey bentar mudik,zen_shuko,Sun Mar 31 02:30:50 +0000 2024,Netral
utama selamat tips mudik 2024,anericanlirry,Sun Mar 31 07:57:06 +0000 2024,Netral
seingetku kalo ngawisalatiga awal 120rb barusan cek gmaps udah 170500 jadi ngarep tol gratisin mudik kek negara tetangga wkwkwk lebih baik simpan angan angan kalian paman hidup negara bu,MasMasBiassaa,Mon Apr 01 14:43:09 +0000 2024,Netral
mudik,justcallmechun,Mon Apr 01 21:24:35 +0000 2024,Netral
mudik murah melu motis buka h1,calomagang,Mon Apr 01 12:40:38 +0000 2024,Netral
buat mudik selamat kumpul sanak keluarga hati2 jalan utama selamat bukan cepat anda mau mudik bukan mau antar cabe,innovacommunity,Mon Apr 01 06:22:46 +0000 2024,Netral
mudik ga mudik penting puasa tuju,yudiahmadd,Mon Apr 01 21:34:39 +0000 2024,Netral
umum info gage mudik lebaran mulai tanggal 5 april 2024 laku sistem ganjilgenap ruas jalan tol jakarta cikampek simpan share post untuk kamu rekan rencana mudik tanggaltanggal atas sobat tmcpoldametrojaya mudik,TMCPoldaMetro,Mon Apr 01 03:47:59 +0000 2024,Netral
apa sangat lama asa bosan yakni minggu akhir tuju mudik kerja rantau,tetestuang,Mon Apr 01 20:57:34 +0000 2024,Netral
biar gak mati gaya bikin mood lo ngedrop kuy sedia pop mie mudik top up seru lo rasa gurih toppingnya bikin momen ramadan sampe mudik lo seru faedah bareng pop mie sob kuy buru stock up pop mie topupserunyaberfaedah,ngePopMie,Mon Apr 01 14:14:42 +0000 2024,Positif
wah nyata mayoritas rencana naik transum hal sedikit tolak belakang dgn hasil studi kemenhub tahun 2023 sebut mayoritas masyarakat mudik guna kendpri ngomongin mudik kaya asyik lik fenomena tahun buah utas singkat,stravenues,Mon Apr 01 13:57:10 +0000 2024,Netral
mudik gratis tebak mobil paslon mana yg jelas sih bukan dr genjer kan uban ga,Gi_N0ng,Mon Apr 01 06:41:04 +0000 2024,Netral
mobil harga lcgc klo bawa mudik bakal cap sultan di jamin bakal banyak mau minjem duit amp nitip anak nya cariin kerja di jkt alphard gen 1 ah10 keluar tahun 20032008 harga kisar 125200jt dengan mesin 2400cc 4azfe amp 3000cc 1mzfe,innovacommunity,Mon Apr 01 06:46:11 +0000 2024,Netral
mau mudik decluttering baju,serifkelot,Mon Apr 01 23:23:57 +0000 2024,Netral
kapan amp mana bayar zakat fithri di masjid rumah dah diingetin utk keluar zakat fithri mudik padahal idul fithri 9 hari terus kalo bayar zakat fithri kampung ga tuh miturut jelas ust ammi demikian boleh allaahu alam,Just_Ab1,Mon Apr 01 05:59:35 +0000 2024,Netral
polri terap bijak rekayasa lalu lintas sistem ganjilgenap sesuai kondisi lapang saat arus mudikbalik lebaran 2024 ikut jadwal laku sistem ganjilgenap lama arus mudik arus balik lebaran 2024 sobat polri catat tanggal,DivHumas_Polri,Mon Apr 01 05:04:11 +0000 2024,Netral
sorry lebih tuju ada rutin program mudik gratis bus kereta api kapal ketimbang gratis tarif jalan tol,txttransportasi,Mon Apr 01 04:20:00 +0000 2024,Negatif
slmt pgiee edisi mudik hari si kkak msh ngantuk kalian udh mudik blum nich temu lebaran nnti uncleaunty semua,hharulas,Mon Apr 01 22:56:06 +0000 2024,Netral
