full_text,username,created_at,klasifikasi
demi allah orang mau mudik,chanchanzip,Mon Mar 25 04:05:59 +0000 2024,Netral
later we will mudik to the same house,z_royaaaaaaaaaa,Mon Mar 25 09:44:55 +0000 2024,Netral
mudik lebaran,coeywna,Mon Mar 25 04:43:20 +0000 2024,Netral
keluarga hilgers mudik indonesia lihat cukup sering sempat diri utk libur indonesia,UpdateBolabola,Mon Mar 25 06:42:49 +0000 2024,Netral
gibah mudik,ayiicntik,Mon Mar 25 08:31:46 +0000 2024,Netral
siap mudik mokpo ngangon sapi sama ayang,fujamandal,Mon Mar 25 12:25:33 +0000 2024,Netral
aseek tarif tol naik oke gas oke gas pluto,AlnilamOmar,Mon Mar 25 09:59:52 +0000 2024,Netral
mudik dluan hehe,nisaetusfloris,Mon Mar 25 04:01:07 +0000 2024,Netral
tuju puncak arus mudik lebaran,Rorikalishaa,Mon Mar 25 12:38:16 +0000 2024,Netral
mudik duluan yah,ininabobo,Mon Mar 25 01:26:51 +0000 2024,Netral
ngapain saing sama nabi dah masuk surga bang bukan rebut tiket mudik,ribonk,Mon Mar 25 06:16:39 +0000 2024,Netral
minggu depan mudik kr,_ayundaprs,Mon Mar 25 23:15:24 +0000 2024,Netral
hoi mudik coyyy bukber siaaa teh,anyeunlir,Mon Mar 25 05:03:22 +0000 2024,Netral
operasi ketupat 2024 polri siaga 155165 ribu personel aman arus mudik lebaran news,liputan6dotcom,Mon Mar 25 08:53:35 +0000 2024,Netral
koper mudik awet a thread t rekomendasi saran koper kokoh kuat pulang kampung lebaran hari raya libur muat banyak size besar,usefulstuffs,Mon Mar 25 10:10:22 +0000 2024,Netral
pikir mudik motor,patria_tigabp,Mon Mar 25 12:33:44 +0000 2024,Netral
gimana gak ken mudik cobak,DokFun,Mon Mar 25 14:45:25 +0000 2024,Netral
tanggal 6 april udah mudik kalau gw bikin kpr kelas produk ringkas product metric yang mau ikut ndak ya,kotakmakan,Mon Mar 25 03:18:37 +0000 2024,Netral
redpunk mau mudik,andreatslonika_,Mon Mar 25 00:58:15 +0000 2024,Netral
war takjil tinggal war tiket mudik,mjnugraha,Mon Mar 25 17:07:44 +0000 2024,Netral
ksksks heejin kek org mau mudik bawa barang bawa banyak,ssugarcoookies,Mon Mar 25 17:22:17 +0000 2024,Netral
wtt want to trade sonny angel have bear baking treats want dalmation getting ready tags songel hsh home sweet home dalmi roti o lempuyangan asu mudik help,megvmiik,Mon Mar 25 15:52:32 +0000 2024,Positif
pagiiiii buat bekal libur mudik bakal banyak judul nemenin nih rencana 3 pekan rombong judul ini bocor awal bulan apreal moga jadwal tepat waktu,comic_lxlc,Mon Mar 25 02:13:56 +0000 2024,Netral
lebaran kalian mudik ga,jembulnana,Mon Mar 25 03:32:43 +0000 2024,Netral
beliau mudik kampung halaman,terriyakikatsu,Mon Mar 25 14:40:20 +0000 2024,Netral
polri hal korps lalu lintas siap pola kelola arus mudikbalik lebaran tahun 2024 mari sama jaga kamtibmas pasti nyamansambutkemenangan,Sekdemangpmj,Mon Mar 25 10:40:46 +0000 2024,Netral
serbaserbi mmc mudik jadi tradisi masyarakat ingat banyak masyarakat hidup rantau hanya masyarakat hadap harga tiket pesawat cenderung mahal jelang hari raya,moc4B3nt0,Mon Mar 25 11:52:19 +0000 2024,Netral
2016 2020 mudik nya jauh,donitanjung,Mon Mar 25 06:08:36 +0000 2024,Netral
mudik nan jauh dimato inimahhhh,bimbiimbum,Mon Mar 25 08:00:40 +0000 2024,Netral
siap2 mudik lebaran d kampung gaess,luky41331840212,Mon Mar 25 08:21:35 +0000 2024,Netral
kapolri mudik tahun 2024 tingkat 56 banding 2023,CimahiRes,Mon Mar 25 12:23:43 +0000 2024,Netral
secured my mudik ticket,psycheracha,Mon Mar 25 09:39:51 +0000 2024,Netral
kapolri mudik tahun 2024 tingkat 56 banding 2023,HumasResPWK,Mon Mar 25 10:32:01 +0000 2024,Netral
kapolres cirebon kota laksana survey siap jalur mudik balik lebaran 2024,HumasResCiko,Mon Mar 25 16:34:19 +0000 2024,Netral
reminder ingat temanteman mau ambil arv bulan depan bahwa cuti sama hari raya idul fitri 1445 h mulai tanggal 814 april 2024 jadi pasti lama libur lebaran stok arv kalian amanyang mudik kumpul keluarga kondisi baik,Survivorjbi,Mon Mar 25 15:28:48 +0000 2024,Netral
lebaran mas minggu lg udh mudik aje lu,1619CORES,Mon Mar 25 10:00:34 +0000 2024,Netral
jadwal one way mudik jakarta semarang balik,Retno318,Mon Mar 25 22:29:04 +0000 2024,Netral
met mudik all,venuuzel,Mon Mar 25 10:33:36 +0000 2024,Netral
wtb tunik chakira chea model apa aja adal bw males war ga dapet2 udh keburu mudik,onyourz_ou,Mon Mar 25 14:12:14 +0000 2024,Netral
i will buy the ticket once im sure i can actually watch it lol pas gue pulang mudik jadi gatau masih jalan bagaimana,manddeddiddi,Mon Mar 25 05:18:52 +0000 2024,Positif
rakor operasi ketupat 2024 kapolri siap mudik idul fitri aman lancar,tvOneNews,Mon Mar 25 17:12:07 +0000 2024,Netral
tementemen ada rencana mudik lebaran dontworrynorugi kalian wujudin kumpul sama keluarga bareng traveloka ada diskon tiket pesawat hotel amp atraksi sd 50 jangan sampe lewat promonya guys cek sini,catsedih,Mon Mar 25 14:59:28 +0000 2024,Netral
panglima tni kerah 67955 personel aman mudik dan libur lebaran 2024 tni lebaran aman,sinpotv,Mon Mar 25 16:30:00 +0000 2024,Netral
mudik ashina lalu sebar demokrasi,mbakvene,Mon Mar 25 05:32:47 +0000 2024,Netral
gt lebaran bentar gt open gmaps gt beri tanda tiap rest area panjang jalur mudik gt kunjung tiap rest area pom bensin masuk gt prioritas ada booth mi instan official gt doing this every year gt actually enjoy the trip not me,SussyJoe_08,Mon Mar 25 19:06:45 +0000 2024,Positif
preordernya lama bgt ajg 2 minggu lebih mana mau bawa mudik bgst,beyippi,Mon Mar 25 06:36:07 +0000 2024,Netral
ngasih info temen mudik gratis angkut,ratupauss,Mon Mar 25 18:49:26 +0000 2024,Netral
mau mudik dilema kucing2 bawa diinapin pet hotel,myrisable,Mon Mar 25 14:42:18 +0000 2024,Netral
siapa kalo pergi jauh mudikliburandinas selalu siapin playlist khusus didengerin lama jalan,bzcult,Mon Mar 25 06:16:52 +0000 2024,Netral
nyari uang dlu mudik,ABDULFATAH19322,Mon Mar 25 14:15:16 +0000 2024,Netral
smg jalan udh mulai kosong mudik,fithandy,Mon Mar 25 00:25:50 +0000 2024,Netral
tiket mudik,Rda_cityxx,Mon Mar 25 08:19:48 +0000 2024,Netral
weekend dah mudik,aizenbites_,Mon Mar 25 22:54:06 +0000 2024,Netral
akhir bentar mudik aaaa,formeonel,Mon Mar 25 02:52:15 +0000 2024,Netral
war preloved asa war tiket mudik,rafnotsimonss,Mon Mar 25 06:24:02 +0000 2024,Netral
warga jakarta timur hendak mudik lebaran titip kendara motor gratis kantor polisi,kompascom,Mon Mar 25 22:28:05 +0000 2024,Netral
dapet tiket mudik gratis susah bgt anjjjj,AnotherOfRel,Mon Mar 25 13:01:27 +0000 2024,Netral
buat skripsi gw serasa mudik,Jaretz_07,Mon Mar 25 09:24:12 +0000 2024,Netral
info mudik perintah imbau masyarakat pulang kampung halaman lebih awal,tvOneNews,Mon Mar 25 22:03:09 +0000 2024,Netral
pikir ken mudik aja,primpri7,Mon Mar 25 04:52:00 +0000 2024,Netral
mau mudik tp tiket bis mahal bgt sih,flowerrrr125,Mon Mar 25 03:52:19 +0000 2024,Netral
skrg aku udh ketawa krna udh beli tiket mudik beli baju lebaran,auliadftr,Mon Mar 25 19:31:56 +0000 2024,Netral
rasa lebaran mudik naik kapal tuh gmna sih,sarahnabbb,Mon Mar 25 14:57:35 +0000 2024,Netral
malem mudik bareng sayang anin dia bekasy aku jakarta,ijustired,Mon Mar 25 15:44:05 +0000 2024,Netral
polri peta jalan rusak rawan laka jalur arus mudik lebaran 2024,humaspolsek_rdk,Mon Mar 25 10:48:19 +0000 2024,Netral
yang mudik dr jakarta pati gak mau bareng,wisteriamoonn,Mon Mar 25 12:56:46 +0000 2024,Netral
siap mudik beli bantal leher,ramahaar,Mon Mar 25 13:18:41 +0000 2024,Netral
kip kapan cair yaa butuh ongkos mudik,tukangceurik,Mon Mar 25 11:30:06 +0000 2024,Netral
tanggal gin achieve dapet tiket mudik nang aja deh raaa,diantaraparkian,Mon Mar 25 15:56:58 +0000 2024,Netral
jakartawonogiri story 638km p mudik ora h tanggal piro kontak tamplop nggo hajat ky,Rikydwisantoso2,Mon Mar 25 00:57:25 +0000 2024,Netral
ka lame yo mudik es,ogutdekna,Mon Mar 25 10:26:18 +0000 2024,Negatif
ukhti arab mudik gak om,adychelsea20,Mon Mar 25 14:43:20 +0000 2024,Netral
kali beneran mudik,fetterbane,Mon Mar 25 23:13:23 +0000 2024,Netral
selamat pagiii sender udah mudik hari,tanyakanrl,Mon Mar 25 23:24:51 +0000 2024,Netral
lagu jkt48 mudik daerah banyak jalan rusak pulang lampung sawityowitedisijkt48,ledekrepp,Mon Mar 25 21:01:53 +0000 2024,Netral
charles mudik dluan,pieastrizz,Mon Mar 25 09:51:58 +0000 2024,Netral
kalian mudik tanggal berapa,fearleeass,Mon Mar 25 23:37:21 +0000 2024,Netral
met pagiiii kalian lebaran mudik ga,akariisoraaa,Mon Mar 25 00:55:08 +0000 2024,Netral
angkut mudik mulai siap,haryabas,Mon Mar 25 20:38:15 +0000 2024,Netral
ribet mau mudik yaallah ide siapa siiii bjir,szunflowwy,Mon Mar 25 22:12:37 +0000 2024,Netral
mudik ngga,aizenbites_,Mon Mar 25 22:45:25 +0000 2024,Netral
ken mudik ga ken keluar duit,rmttarr,Mon Mar 25 21:16:33 +0000 2024,Netral
otw mudik,0raJelas,Tue Mar 26 10:32:40 +0000 2024,Netral
kalian mudik kampung mau bawa apa,innovacommunity,Tue Mar 26 06:46:47 +0000 2024,Netral
mudik sama anabul emang bisa kalian punya anabul sayang bingung mau titip mana mudik lebaran bawa mudik kampung halaman aja bestie lho emang bukan boleh bawa hewan dalam kereta api tenang tenang kirim,KAI121,Tue Mar 26 05:06:24 +0000 2024,Netral
wujud jalan mudik anda jadi lebih tenang oto proteksi maksima dapat jamin ganti rugi atas rugi bagi hingga rusa total proteksi kendara usia hingga 15 tahun jamin risiko sesuai tentu laku info lengkap,promo_BRI,Tue Mar 26 11:41:04 +0000 2024,Netral
suasana mudik tempo doeloe,Astee_mou,Tue Mar 26 00:17:28 +0000 2024,Netral
rekomendasi barang siap mudik shopee a thread,archqry,Tue Mar 26 10:27:28 +0000 2024,Netral
mudik kapan lur,jawafess,Tue Mar 26 10:16:02 +0000 2024,Netral
for sale blackpink born pink deluxe edition limitied lp lama simpan akhir berfikir lebih baik album keren antar pulang mudik kampung halaman mudah mudah yang minat lengkap semua,herjunedd,Tue Mar 26 05:19:14 +0000 2024,Positif
barang barang mungkin kamu butuhin mudik traveling,brownsyeger,Tue Mar 26 06:32:22 +0000 2024,Netral
giveaway d day the movie indonesia rules like army only followers only yang sedia julid pc benefitnya aku soal aku ga nonton karna mudik untuk 1 orang end nya besok pagi jam 9 langsung aku transfer beli tiket nya sendiri,mygaddicted_,Tue Mar 26 09:24:43 +0000 2024,Netral
ayo matang siap mudik selalu jaga kesahatn dasar survei prediksi tahun gera masyarakat ingin mudik sangat meninggkat bisa cek jadwal one way contraflow lebaran 2024 lebaranamannyaman,sayadebus,Tue Mar 26 06:50:58 +0000 2024,Netral
deg deg an sama issue thr kalau memang besar berita kayak batal mudik aja lah mending simpan aja uang beli beras memang negara jahanam jalan negara tetap jelek sekolah gedung tetap banyak bobrok gaji guru nakes tetap kecil apa dipajakin,ImaIsBack,Tue Mar 26 11:46:41 +0000 2024,Netral
gw inget lebaran 2018 gw sibuk jawab pasu seword display namenya remingston steele tuduh program mudik bareng pemprov dki korupsi padahal ngetwit asal sekarang program mudik bareng nya ada alhamdulillah,AnggaPutraF,Tue Mar 26 03:29:19 +0000 2024,Netral
musim mudik calo tiket jamur,RK_Lamongan,Tue Mar 26 08:46:31 +0000 2024,Netral
tb last year puasa malah main arcade sama tetawan pas event makro impact lucky2an belanja 1000 baht lupa mumpung muk mudik belanja kirim rumah jd yaudah deh iseng ikut beli jajan sm thai tea oleh2 agak saltum gegara gatau lucky2an,tertawan__,Tue Mar 26 05:10:58 +0000 2024,Positif
polri imbau masyarakat mudik guna kendara roda duamotor milik tingkat risiko lebih tinggi jadi celaka lalu lintas matang siap mudik demi lebaranamannyaman,Res1Tulungagung,Tue Mar 26 06:01:05 +0000 2024,Netral
sobat polri dasar hasil survei prediksi tahun potensi gera masyarakat akan laku jalan mudik sangat tingkat dalam ini korlantas polri sama stakeholder kait siap aman arus lalu lintas gelar pos aman,DivHumas_Polri,Tue Mar 26 05:00:30 +0000 2024,Netral
polri imbau masyarakat mudik guna kendara roda duamotor milik tingkat risiko lebih tinggi jadi celaka lalu lintas matang siap mudik demi lebaranamannyaman,humaskedirires,Tue Mar 26 05:52:22 +0000 2024,Netral
kamu mudik ga tahun,xbaebearx,Tue Mar 26 01:36:26 +0000 2024,Netral
jangan lupa tempel servernya mudik mas,as_sulthoni,Tue Mar 26 09:47:21 +0000 2024,Netral
kakorlantas polri irjen pol dr drs aan suhanan sama menko pmk muhadjir effendy menhub budi karya sumadi hadir rapat koordinasi angkut lebaran 2024 jalur tolmatang siap mudik wujud lebaranamannyaman,humaspoldalpg,Tue Mar 26 05:45:18 +0000 2024,Netral
kapolri jenderal polisi drs listyo sigit prabowo pimpin rapat koordinasi rakor lintas sektoral operasi ketupat 2024 hotel bidakara jakarta utara senin 253 matang siap mudik wujud lebaranamannyaman,Res1Tulungagung,Tue Mar 26 05:53:30 +0000 2024,Netral
rakor siap aman arus mudik 2024,PolsekKroya,Tue Mar 26 08:46:16 +0000 2024,Netral
kalian lebaran mudik egk,busanbbys7,Tue Mar 26 15:20:55 +0000 2024,Netral
kalian lebaran tim mudik tidak,convomfs,Tue Mar 26 06:13:07 +0000 2024,Netral
gak ken gitu ngerasain mudik pulau seberang,NHPeeeeeeeeel,Tue Mar 26 12:03:28 +0000 2024,Netral
polri imbau masyarakat mudik guna kendara roda duamotor milik tingkat risiko lebih tinggi jadi celaka lalu lintas matang siap mudik demi lebaranamannyaman,HumasPoldaJatim,Tue Mar 26 05:40:12 +0000 2024,Netral
halo driver ojol ngebid rantau kalian acara mudik mudik kapan amp mudik naik apa admin mudik lebaran h3 solo motor ayomudik,GojekOnTwitt,Tue Mar 26 15:32:39 +0000 2024,Netral
kakorlantas polri irjen pol dr drs aan suhanan ungkap aman arus mudikbalik lebaran 2024 beberapa tambah titik krusial nanti diri pos pantau tol trans jawa matang siap mudik lebaranamannyaman,HumasPoldaJatim,Tue Mar 26 05:38:08 +0000 2024,Netral
kalian mudik,ruzerush,Tue Mar 26 03:43:04 +0000 2024,Netral
3 alas tidak mudik dengan motor,PolsekBdg,Tue Mar 26 06:37:53 +0000 2024,Negatif
kasihan philippe troussier bentar lebaran thr cair malah udah pecat ama vietnam ga bayang pas mudik rumah urung diri di kamar ponakan datang,MafiaWasit,Tue Mar 26 22:08:31 +0000 2024,Netral
kasus rasa watulimo polres trenggalek tetap empat sangka polisi resor trenggalek aman jumlah pemuda asal watulimo kabupaten trenggalek awesomeeveryday matang siap mudik wujud lebaranamannyaman,1trenggalek,Tue Mar 26 05:21:18 +0000 2024,Netral
alas gak mudik lebaran 2024 mudik tahun 2021 kena marah ortu gak bawa pacar mudik tahun 2022 bawa pacar masih kena marah bukan bawa istri mudik tahun 2023 udah bawa istri masih kena marah itu istri orang ngik,HumorJonTampan,Tue Mar 26 04:07:48 +0000 2024,Negatif
supertop angkat pagi cuy gilak bis nyaman parah sih rosalia indah cileungsi madiun supertop 21 rp 360000 rekomendit lo mudik nih bree,dprpbismalam,Tue Mar 26 13:49:27 +0000 2024,Netral
mengapa mudik guna transportasi umum usaha lebih keluar ongkos tambah dapat pulang kampung halaman saksi docuseries kareem edisi mudik macet mahal tayang youtube watchdoc image ramadan,watchdoc_ID,Tue Mar 26 11:36:12 +0000 2024,Netral
bismillah mudik min,reviadi23,Tue Mar 26 20:39:23 +0000 2024,Netral
polri pasti kesiap fisik kendara belum mudik kakorlantas polri irjen pol dr drs aan suhanan ungkap aman arus mudikbalik lebaran 2024 lebaranamannyaman,PolsekKertasari,Tue Mar 26 06:11:22 +0000 2024,Netral
anak jendral mau mudik di siapin bis ke kampung ne bolone masse,SugengR46374688,Tue Mar 26 10:34:42 +0000 2024,Netral
polri pasti kesiap fisik dan kendara belum mudik,CikakakPol2363,Tue Mar 26 12:00:29 +0000 2024,Netral
selamat tunai ibadah mudik,qi_uqi,Tue Mar 26 04:57:19 +0000 2024,Netral
jam 11 malam off mau mudik jakarta habis lebaran,Monickiandraa,Tue Mar 26 03:56:33 +0000 2024,Netral
kapolri jenderal polisi pimpin rapat koordinasi rakor lintas sektoral operasi ketupat 2024 hotel bidakara jakarta utara senin 253 matang siap mudik wujud lebaranamannyaman timnasday,1trenggalek,Tue Mar 26 05:32:54 +0000 2024,Netral
tips jalan mudik aman sama keluarga,Humasbdgkidul6,Tue Mar 26 08:04:32 +0000 2024,Netral
girl its too early to mudik,givebackmypoop,Tue Mar 26 15:11:17 +0000 2024,Positif
koorlantas polri siap strategi antisipasi padat mudikbalik lebaran,PolsekKroya,Tue Mar 26 08:40:23 +0000 2024,Netral
bp2mi siap jadwal piket 24 jam sedia sarana prasarana koordinasi telah terbit surat edar layan pulang kerja migran indonesia jelang mudik hari raya idul fitri tahun 1445 h bp2mi sikatsindikat,chandraLaras22,Tue Mar 26 03:18:46 +0000 2024,Netral
kapolri jenderal polisi drs listyo sigit prabowo pimpin rapat koordinasi rakor lintas sektoral operasi ketupat 2024 hotel bidakara jakarta utara senin 253 matang siap mudik wujud lebaranamannyaman,HumasPoldaJatim,Tue Mar 26 05:42:40 +0000 2024,Netral
bismillah mudik min,reviadi23,Tue Mar 26 20:40:29 +0000 2024,Netral
thinkin bout going to periplus aaa would buy some book mudik,minelnell,Tue Mar 26 22:57:35 +0000 2024,Netral
kapolri jenderal polisi drs listyo sigit prabowo pimpin rapat koordinasi rakor lintas sektoral operasi ketupat 2024 hotel bidakara jakarta utara senin 253 bahas siap aman arus mudikbalik lebaran 2024 lebaranamannyaman,Polsek_Kalidoni,Tue Mar 26 06:39:09 +0000 2024,Netral
tips jalan mudik aman sama keluarga sumber,CibeunyingKidul,Tue Mar 26 16:38:01 +0000 2024,Netral
me packing up for mudik,berakbeol,Tue Mar 26 15:12:37 +0000 2024,Netral
sobatmigran sambut hari raya idul fitri selalu ikut tradisi mudik lebaran benny rhamdani turut peduli penting nyaman selamat untuk sobatmigran laku jalan simak video bawah bp2mi bp2miri,kyana805,Tue Mar 26 15:39:03 +0000 2024,Netral
mudik rencana tanggal berapa,Setengahmateng_,Tue Mar 26 13:16:18 +0000 2024,Netral
sambut hari raya idul fitri selalu ikut dgn tradisi mudik lebaran bp2mi turut peduli penting nyaman selamat sobatmigran jalan yuk simak video skema bp2mi untuk nyaman jalan bp2mi sikatsindikat,najwa_fais,Tue Mar 26 13:22:19 +0000 2024,Netral
sobatmigran sambut hari raya idul fitri selalu ikut tradisi mudik lebaran bp2mi turut untuk peduli penting nyaman selamat jalan simak video untuk nyaman jalan sobatmigran serta nmr kontak bisa hubung,pedjoeang_nkri,Tue Mar 26 14:41:35 +0000 2024,Netral
mau mudik ya allah rohman rohim bismillah,BukanPejabatEuy,Tue Mar 26 06:45:49 +0000 2024,Netral
bp2mi siap jadwal piket 24 jam sedia sarana prasarana koordinasi bp2mi terbit surat edar layan pulang kerja migran indonesia jelang mudik hari raya idul fitri tahun 1445 hijriah sikatsindikat,YuliSugiyanto06,Tue Mar 26 02:41:03 +0000 2024,Netral
sambut hari raya idul fitri selalu ikut dgn tradisi mudik lebaran bp2mi peduli penting nyaman amp selamat utk sobatmigran laku jalan yuk simak video skema ikut utk nyaman jalan sobatmigran lengkap nomor kontak bisa hubung,Bambiboo81,Tue Mar 26 11:56:22 +0000 2024,Netral
ga mau ikut mudik khusus kaum sandang disabilitas,indra_hutapea,Tue Mar 26 14:56:09 +0000 2024,Netral
kapolri jenderal polisi drs listyo sigit prabowo pimpin rapat koordinasi rakor lintas sektoral operasi ketupat 2024 hotel bidakara jakarta utara matang siap mudik wujud lebaranamannyaman,PolsekNagreg,Tue Mar 26 06:27:21 +0000 2024,Netral
yuk guys sobatmigran silah simak video skema kami nyaman jalan sobatmigran jangan lupa kami lengkap nomor kontak bisa hubung moga jalan mudik sobatmigran senang,67Agus_,Tue Mar 26 10:52:12 +0000 2024,Netral
awas 116 titik rawan banjir jalur mudik 112 jalur alternatif,alisyarief,Tue Mar 26 02:18:45 +0000 2024,Netral
sobatmigran sambut hari raya idul fitri selalu ikut tradisi mudik lebaran bp2mi turut peduli penting nyaman selamat untuk sobatmigran laku jalan sikatsindikat bp2mi,berli_flo,Tue Mar 26 11:17:23 +0000 2024,Netral
simak nih video skema bp2mi nyaman jalan sobatmigran jangan lupa bp2mi lengkap nomor kontak bisa hubung moga jalan mudik sobat migran senang sikatsindikat,VaniaCiprut,Tue Mar 26 11:38:43 +0000 2024,Netral
tni sedia kapal perang mudik tuju semarang surabaya temporamadan,tempodotco,Tue Mar 26 18:45:06 +0000 2024,Netral
oke banget kalau bayar mudik pesawat alfamart tiap bayar tiket pesawat di alfamart potong rp25000 maskapai citilink air asia amp lion air bonus 100 apoin guna member periode 01 maret 31 mei 2024,alfamart,Tue Mar 26 13:01:47 +0000 2024,Netral
hai sobatmigran dalam sambut hari raya idul fitri selalu ikut tradisi mudik lebaran bp2mi turut peduli penting nyaman selamat untuk sobatmigran laku jalan bp2mi sikatsindikat,oliverceanic9,Tue Mar 26 13:25:05 +0000 2024,Netral
buat siap mudik miiin,brotbroooooooot,Tue Mar 26 21:01:10 +0000 2024,Netral
mudik duluan gaes,camelilys,Wed Mar 27 07:49:43 +0000 2024,Netral
mau mudik nyiapin barang bawa mudik nyiapin security camera,Alimustoofaa,Wed Mar 27 20:11:15 +0000 2024,Netral
mau mudik nih cari waktu pas berangkat biar gak kena macet masuk cek kesiap jalur mudik salah satu jalan tol mungkin bakal lewat mantapsiapkanmudik yuk biar ber lebaran dengan nyaman,nona_vonee,Wed Mar 27 05:54:39 +0000 2024,Netral
mudik gratis,rasjaglatik,Wed Mar 27 12:19:30 +0000 2024,Netral
bentar mudik jangan lupa prepare skincare makeup kalian oiya nanti lebaran make up an jangan lupa bawa micellar water travel bag mu ini aku pake micellar water 300 ml biar gak perlu takut kalo sodara minta pas abis kumpul2,glowinbeautyy,Wed Mar 27 08:33:49 +0000 2024,Netral
lebaran makin dekat waktu mudik nih pasti banyak banget barang bawa ini ide koper tas cocok mudik muat banyak barang isi lebih rapi,gyanetta_,Wed Mar 27 04:29:17 +0000 2024,Netral
mudik gratis,CoffenBee,Wed Mar 27 20:38:25 +0000 2024,Netral
kapolri kata siap jalur alternatif bagai wilayah antisipasi banjir lama momen mudik lebaran 2024 makin mantapsiapkanmudik lebaran dengan nyaman,lahguamahsaik,Wed Mar 27 05:50:00 +0000 2024,Netral
early mudik,rockbrotherhoo,Wed Mar 27 15:34:15 +0000 2024,Positif
semangat yang thrnya udah tip ganti oli ban benerin ac mudik jangan lupa siapin lindung allianz mobil yaa nah mimin mau kasih aksesoris kece manfaat jalan mudik yuk ikut giveaway pulangkampungnyaman,AllianzID,Wed Mar 27 07:55:38 +0000 2024,Netral
jalan mudik 2thn lalu rumah nl schiphol 45 menit nunggu take off 2 jam direct nl jkt 15 jam transit jkt 8 jam jkt sby 1 jam nunggu bagasi mobil travel 2 jam sby desa njember 6 jam total door to door 35 jam hitung butuh brp balut,Denald,Wed Mar 27 19:30:43 +0000 2024,Positif
jadi ken mudik laah mudik,M3ChaN_1,Wed Mar 27 14:46:08 +0000 2024,Netral
info mudik,rasjaglatik,Wed Mar 27 12:25:42 +0000 2024,Netral
alternatif yang habis tiket mudik berangkat 2 rute barat rute 1 jakarta smg slo jog rute 2 bogor smg slo jog harga tiket cantum cara mesan detail jalan sila cek masingmasing gambar trims,terustouring,Wed Mar 27 04:35:34 +0000 2024,Netral
hindar puncak arus mudik,Titiksu2023,Wed Mar 27 13:39:12 +0000 2024,Netral
mudik,CoffenBee,Wed Mar 27 20:38:48 +0000 2024,Netral
mudik lebaran 2024 ikut 3 layan seberang tuju pulau sumatera rabu 3 april 2024 sd selasa 9 april 2024 sobat polri siapa nih sudah siap laku mudik lebaran 2024 nah kamu akan mudik pulau sumatera yuk simak 3 layan penyebrangan,DivHumas_Polri,Wed Mar 27 04:36:11 +0000 2024,Netral
tips siap mudik,humas_sekpatrol,Wed Mar 27 06:27:24 +0000 2024,Netral
mudik,CoffenBee,Wed Mar 27 20:39:41 +0000 2024,Netral
mudik gratis polisi nih,Gasspool19,Wed Mar 27 13:12:54 +0000 2024,Netral
good day guten morgen aku udah mulai puasa hari dan besok pulang mudik kampung halaman semangat puasa yang jalan kan,Queenbeauu,Wed Mar 27 23:09:59 +0000 2024,Positif
udah mulai mudik,aidenxvx,Wed Mar 27 03:43:26 +0000 2024,Netral
mudik gratis polri,mantanbagu15179,Wed Mar 27 12:14:20 +0000 2024,Netral
makna mudikpulang kampung turut apasih guys ini surat cinta kepada melbi kena beberapa karya utama single pulang kampung tetap relevan kitakita masih tanya makna pulang kampung alami krisis eksistensi,rickydotalfan,Wed Mar 27 14:07:10 +0000 2024,Negatif
simak himbauan polisi jelang mudik lebaran 2024,samuelernando22,Wed Mar 27 14:39:06 +0000 2024,Netral
sebentar musim mudik biar ga liat kucel lama perjalananngurangin perintilan make up kalian khusus urus blush on aku rekomendasi blush on travel friendly ada 2 warna rate 49 cek sini,hibbiness,Wed Mar 27 08:12:49 +0000 2024,Positif
mudik,BudiPras975358,Wed Mar 27 21:47:24 +0000 2024,Netral
mudik ada polisi pasti aman nyaman,samuelernando22,Wed Mar 27 14:45:45 +0000 2024,Netral
mudik gratis,Ferri254,Wed Mar 27 13:42:05 +0000 2024,Netral
mudik gratissss,Titiksu2023,Wed Mar 27 13:44:25 +0000 2024,Netral
halo kelik polda lampung ikut tips mudik aman nyaman polri poldalampung kapoldalampung pestademokrasisehat polrihumanis polripresisi ayojagapersatuandankesatuanbangsa cintakebhinekaan lebaran2024,humaspoldalpg,Wed Mar 27 03:21:26 +0000 2024,Netral
mudik,CoffenBee,Wed Mar 27 20:39:06 +0000 2024,Netral
mudik lebaran 2024 ikut 3 layan seberang tuju pulau sumatera rabu 3 april 2024 sd selasa 9 april 2024 yuk simak 3 layan seberang ikut mantapsiapkanmudik wujud lebaran dengan nyaman sumber ntmc,HumasPoldaJatim,Wed Mar 27 05:38:47 +0000 2024,Netral
yuk komen sebanyaknyabanyaknya menangin hadiah khayal bareng minbon yuk anda kamu pilih kampung bebas kamu mau mudik mana tulis jawab kamu kolom komentar sebanyakbanyaknya 5 menang untung bakal dapet hadiah hampers loh,BonCabe,Wed Mar 27 13:52:38 +0000 2024,Netral
info mudik,CoffenBee,Wed Mar 27 20:38:51 +0000 2024,Netral
info mudik lur,Ferri254,Wed Mar 27 13:41:39 +0000 2024,Netral
tips mudik lebaran sobat polri siapa nih sudah siap laku mudik lebaran 2024 nah sobat polri akan laksana mudik lebaran yuk simak tips ikut mantapsiapkanmudik wujud lebaran dengan nyaman,humaspoldalpg,Wed Mar 27 05:55:37 +0000 2024,Netral
3 alas tidak mudik dengan motor,PolsekKdg1946,Wed Mar 27 05:03:20 +0000 2024,Negatif
nukerin tiket mudik gratisssss,pengenjadibaker,Wed Mar 27 06:16:34 +0000 2024,Netral
mantapsiapkanmudik kapolri jenderal polisi drs listyo sigit prabowo sampai polri sama instansi kait siap laku tinjau jalur mudik lebaran 2024 banten hingga jawa timur langkah tuju identifikasi jalur rawan,DivHumas_Polri,Wed Mar 27 05:00:16 +0000 2024,Netral
mantap polri antisipasi mudik2024 mudik,any_cinta88,Wed Mar 27 19:47:32 +0000 2024,Netral
ada mudik gratis ni guys,senopa60331,Wed Mar 27 12:31:00 +0000 2024,Netral
mudik 2024 aman lancar bisa silaturahmi keluarga nyaman,melsalsida,Wed Mar 27 13:20:03 +0000 2024,Netral
